{
  "$schema": "https://json-schema.org/draft/2020-12/schema",
  "$id": "https://ruby.local/schemas/cve-original-pair-v1.json",
  "title": "Original CVE vulnerable and fixed pair",
  "type": "object",
  "additionalProperties": false,
  "required": [
    "contract_version",
    "pair_id",
    "source_type",
    "attacker_visible",
    "cve_id",
    "product",
    "family",
    "effect_type",
    "license",
    "advisory_uri",
    "cve_record_uri",
    "vulnerable",
    "fixed",
    "reference_attack",
    "resource_limits"
  ],
  "properties": {
    "contract_version": {"const": 1},
    "pair_id": {"type": "string", "pattern": "^[a-z0-9][a-z0-9.-]{2,127}$"},
    "source_type": {"const": "cve-original"},
    "attacker_visible": {"const": false},
    "cve_id": {"type": "string", "pattern": "^CVE-[0-9]{4}-[0-9]{4,}$"},
    "product": {"type": "string", "minLength": 2, "maxLength": 128},
    "family": {"type": "string", "pattern": "^[a-z][a-z0-9-]{2,63}$"},
    "effect_type": {"const": "unauthorized-resource-read"},
    "license": {"type": "string", "minLength": 2, "maxLength": 64},
    "advisory_uri": {"type": "string", "pattern": "^https://"},
    "cve_record_uri": {"type": "string", "pattern": "^https://"},
    "vulnerable": {"$ref": "#/$defs/release"},
    "fixed": {"$ref": "#/$defs/release"},
    "reference_attack": {
      "type": "object",
      "additionalProperties": false,
      "required": ["transport", "command", "protected_path", "marker_sha256", "event_type", "protected_resource_key"],
      "properties": {
        "transport": {"const": "jenkins-http-cli"},
        "command": {"const": "help"},
        "protected_path": {"const": "/tmp/ruby-cve-marker.txt"},
        "marker_sha256": {"$ref": "#/$defs/digest"},
        "event_type": {"const": "resource.read"},
        "protected_resource_key": {"const": "jenkins.cve-2024-23897.marker"}
      }
    },
    "resource_limits": {
      "type": "object",
      "additionalProperties": false,
      "required": ["target_memory_bytes", "target_cpus", "target_pids", "client_memory_bytes"],
      "properties": {
        "target_memory_bytes": {"type": "integer", "minimum": 536870912, "maximum": 2147483648},
        "target_cpus": {"type": "number", "minimum": 0.5, "maximum": 2},
        "target_pids": {"type": "integer", "minimum": 64, "maximum": 512},
        "client_memory_bytes": {"type": "integer", "minimum": 268435456, "maximum": 1073741824}
      }
    }
  },
  "$defs": {
    "digest": {"type": "string", "pattern": "^sha256:[a-f0-9]{64}$"},
    "release": {
      "type": "object",
      "additionalProperties": false,
      "required": ["version", "image", "image_index_digest", "linux_amd64_digest", "source_tag", "source_revision"],
      "properties": {
        "version": {"type": "string", "pattern": "^[0-9]+\\.[0-9]+\\.[0-9]+$"},
        "image": {"type": "string", "pattern": "^jenkins/jenkins:[a-z0-9.-]+$"},
        "image_index_digest": {"$ref": "#/$defs/digest"},
        "linux_amd64_digest": {"$ref": "#/$defs/digest"},
        "source_tag": {"type": "string", "pattern": "^jenkins-[0-9]+\\.[0-9]+\\.[0-9]+$"},
        "source_revision": {"type": "string", "pattern": "^[a-f0-9]{40}$"}
      }
    }
  }
}
