{
  "contract_version": 1,
  "pair_id": "jenkins-cve-2024-23897-lts-pair-v1",
  "source_type": "cve-original",
  "attacker_visible": false,
  "cve_id": "CVE-2024-23897",
  "product": "Jenkins Core",
  "family": "path-traversal",
  "effect_type": "unauthorized-resource-read",
  "license": "MIT",
  "advisory_uri": "https://www.jenkins.io/security/advisory/2024-01-24/#SECURITY-3314",
  "cve_record_uri": "https://raw.githubusercontent.com/CVEProject/cvelistV5/main/cves/2024/23xxx/CVE-2024-23897.json",
  "vulnerable": {
    "version": "2.426.2",
    "image": "jenkins/jenkins:2.426.2-lts-jdk17",
    "image_index_digest": "sha256:186a48ae298e34a21b27fe737bf0a854c3e73421ce858c4d40c403802589e23f",
    "linux_amd64_digest": "sha256:fc599f008958e539ae3a59ad65b1f0ff72783bcec77efd8c719454dd13f073ce",
    "source_tag": "jenkins-2.426.2",
    "source_revision": "d9a4e86985c0e15385f82068cce4f83ee8e2f283"
  },
  "fixed": {
    "version": "2.426.3",
    "image": "jenkins/jenkins:2.426.3-lts-jdk17",
    "image_index_digest": "sha256:a786794ea0a2429e65d67a88fe497cbd97a0d73d73a39f2fd0eae3b380eb70ff",
    "linux_amd64_digest": "sha256:7d7371ab14525a0b0032e8a714f8ef6cfe5d0c37e3b9e6b68239543f2df9ba92",
    "source_tag": "jenkins-2.426.3",
    "source_revision": "8610d964f3a5348cf89870c5286bdde91bfd3582"
  },
  "reference_attack": {
    "transport": "jenkins-http-cli",
    "command": "help",
    "protected_path": "/tmp/ruby-cve-marker.txt",
    "marker_sha256": "sha256:8e866c02a45388cef832a1e04b3e529f85daf79c850fef417a2b7912ffc37520",
    "event_type": "resource.read",
    "protected_resource_key": "jenkins.cve-2024-23897.marker"
  },
  "resource_limits": {
    "target_memory_bytes": 1073741824,
    "target_cpus": 1.0,
    "target_pids": 256,
    "client_memory_bytes": 536870912
  }
}
